{
  "kind": "DangerousMissScenarioSpecification",
  "schemaVersion": "1.0.0",
  "scenarioId": "SCN-DM-AGE-003",
  "scenarioVersion": "1.0.0",
  "hazardId": "DM-AGE-003",
  "hazardFamily": "young_infant_or_developmental_edge",
  "planReference": "agentic-research/runs/2026-07-19-pediatric-expansion-arc-readiness/validation_plan.md#DM-AGE-003",
  "syntheticDeclaration": {
    "synthetic": true,
    "nonPatientData": true,
    "notForClinicalUse": true,
    "notAClinicalCase": true,
    "purpose": "SYNTHETIC TEST FIXTURE. Exercises the young-infant scope exit (built-in intervals begin at 6 months) to prove the engine does not silently apply a fallback interval below that boundary. All values are invented for schema and safety-test purposes only."
  },
  "owner": {
    "role": "general-pediatrics-reviewer",
    "name": null,
    "assertion": "role_assigned"
  },
  "candidateBinding": {
    "knowledgeBaseVersion": "0.1.0-2026-07-15",
    "rulesFileDigest": "sha256:f1317f02bca4e46226be04bb131101024a6822a19caf1987b2ffff6ce7bf01a8",
    "candidatesFileDigest": "sha256:361924b25c5b5162054eb8a90f7024d5990afb63c0f8eb2a0a18d22c0b56904c",
    "moduleFileDigest": "sha256:7ebd9ef8a9a1cac4436ccfb7a4e349d29245f791dc9476cdcb1dc1c0f720a4cc"
  },
  "executionBinding": {
    "engine": "anemia-assessment-engine",
    "engineRationale": "Age-scope exit is expressible as a patient-input.schema.json input (ageMonths below 6) and evaluated by assessPediatricAnemia.",
    "blockedOnTask": null
  },
  "input": {
    "kind": "patientInput",
    "patientInput": {
      "patient": {
        "ageMonths": 2,
        "sexAtBirth": "male",
        "menstruating": false,
        "recentTransfusion": false,
        "highAltitude": false
      },
      "cbc": {
        "hemoglobin": 9,
        "mcv": 95
      },
      "reticulocytes": {
        "response": "unknown"
      },
      "labs": {},
      "symptoms": {},
      "history": {},
      "exam": {},
      "smear": []
    },
    "referenceIntervalRequest": null,
    "terminologyObservation": null,
    "profileRef": null
  },
  "expectedBehavior": {
    "type": "fail_closed",
    "requiredSignal": "Age/developmental partitions outside validated scope must not use fallback thresholds silently. Visible scope exit or abstention.",
    "expectedAlerts": [],
    "expectedAbstention": null,
    "expectedBlockers": [
      "AGE_OUT_OF_SUPPORTED_RANGE"
    ],
    "forbiddenSignals": [
      "a resolved hemoglobinLowerLimit, mcvLowerLimit, or mcvUpperLimit for a 2-month-old (no built-in interval covers ages under 6 months)",
      "an anemiaStatus other than indeterminate when no local range is supplied for an age below 6 months",
      "a returned assessment result of any kind (with or without alerts) for an age outside the supported range with no local reference limits supplied — docs/architecture.md ARCH §10 requires a hard refusal ('no assessment produced'), not a returned indeterminate/empty result"
    ]
  },
  "expectedTrace": {
    "mechanism": "none_available",
    "matchedRuleIdsMustInclude": [],
    "note": "EP5-T6 (2026-07-21) supersedes the original 2026-07-19 execution note below. Re-verified by direct execution: assessPediatricAnemia() now throws AgeOutOfSupportedRangeError (code AGE_OUT_OF_SUPPORTED_RANGE, statusCode 400) for this exact input before any rule ever evaluates -- no result object, no provenance.matchedRuleIds, no rule_audit trail exists at all, hence mechanism 'none_available'. SCOPE-001/SCOPE-003 no longer fire for this scenario because assess() refuses before reaching rule evaluation; they remain witnessed elsewhere (tests/witness/alerts/scope-neonatal-young-infant.json, now with cbc.localRanges supplied so the refusal's documented carve-out applies and the module proceeds to fire the alerts). ORIGINAL 2026-07-19 note (behavior superseded, kept for the audit trail): classification.thresholdSource/ageBand/hemoglobinLowerLimit were all null and anemiaStatus/morphology were 'indeterminate' for a 2-month-old with no local ranges supplied via a normally-returned result carrying SCOPE-001/SCOPE-003 alerts; EP5-T6 determined that ARCH §10's 'refuse to assess (not merely narrow limitations text)' requirement was not met by that softer abstention and hardened it to a genuine refusal."
  },
  "rollbackSignal": "Re-verify by execution if modules/anemia/rules.json, candidates.json, or module.json digests change, or if the supportedAge boundary (now read from modules/anemia/module.json's supportedAgeMonths, not hardcoded), modules/anemia/facts.anemia.js#assertAgeWithinSupportedScope, or SCOPE-001/SCOPE-003 are edited.",
  "execution": {
    "state": "not_executed",
    "receipt": null,
    "result": null,
    "adjudication": null,
    "ownerDecision": null
  }
}
